,Datetime,Tweet Id,Text,Retweet Count,Followers,Likes,Username
0,2019-09-29 21:29:49+00:00,1178421648837484545,My phone logs me out of @tradingview about once a month which defaults to $AAPL when I open it. Thinking $BTC dropped to $218 for a split-second is a serious gut check,8,321723,231,VentureCoinist
1,2019-09-20 15:15:59+00:00,1175066079888060416,Not sure the world needs this #slofie #slowmo #selfies setting on the new #iPhone1111 #iPhone but it’s definitely #fun #technology #Apple $aapl pushing past $1tln in market cap again! They’re doing something right @FoxBusiness https://t.co/Pya3zDaBPd,29,52300,443,SusanLiTV
2,2019-09-18 01:10:05+00:00,1174128426749452288,"Imagine launching a vegan ETF and not having $BYND as the top holding. The top 10 holdings (%) of the US Vegan Climate ETF are: $MSFT, $AAPL, $FB, $MA, $V, $UNH, $INTC, $T, $CSCO, $BACOh and their expense ratio is 0.6%... https://t.co/qwvjZdigAT",40,308521,383,RampCapitalLLC
3,2019-09-17 21:55:51+00:00,1174079546796064769,Doesn’t look like one of the largest owners of $AAPL stock in the world from the outside... Tell me again why the Swiss National Bank owns U.S. equities...🤔#PonziFinance https://t.co/lcCrh7VHIv,40,140840,258,MarkYusko
4,2019-09-17 18:29:55+00:00,1174027719870431233,"""Throw your X in the trash!""Attribute that to our friend @reckless... but what about the iPhone 11?Watch what he and @joannastern said about Apple's latest slate of phones, and catch a sneak peek of @jonfortt's Jony Ive impression.@CNBC $AAPL https://t.co/xcSs7g5ngt",32,43601,156,CNBCTechCheck
5,2019-09-17 10:57:02+00:00,1173913746172973057,"Best Performing S&amp;P 500 stocks, last 20 yrs...Monster Beverage $MNST: +72,340%Tractor Supply $TSCO: +33,500%Cognizant Tech $CTSH: +14,150%HollyFrontier $HFC: +10,560%Ventas $VTR: +9,520%Apple $AAPL: +9,260%NVIDIA $NVDA: +9,140%Celgene $CELG: +8,880%- @charliebilello",72,487409,205,SJosephBurns
6,2019-09-16 15:05:54+00:00,1173613990972444672,"Best Performing S&amp;P 500 stocks, last 20 yrs...Monster Beverage $MNST: +72,340%Tractor Supply $TSCO: +33,500%Cognizant Tech $CTSH: +14,150%HollyFrontier $HFC: +10,560%Ventas $VTR: +9,520%Apple $AAPL: +9,260%NVIDIA $NVDA: +9,140%Celgene $CELG: +8,880%Ansys $ANSS: +8,830%",44,492316,170,charliebilello
7,2019-09-16 11:57:39+00:00,1173566614178029568,"Yesterday was the 11th anniversary of the Lehman bankruptcy. Returns if you bought tech stocks at the close that day &amp; held to today...$NFLX: +7,225%$AMZN: +2,278%$NVDA: +2,022%$AAPL: +1,150%$CRM: +1,017%$V: +1,006%$ADBE: +631%$MSFT: +568%$GOOGL: +471%$SPY: +215% https://t.co/MtbnSAMiEH",82,492316,169,charliebilello
8,2019-09-13 21:40:27+00:00,1172626118857261056,Apple had to go its own way instead of taking a stake in Disney and running with the winner. Now Iger resigns from Apple's BOD. Another hit to Apple. Apple vs Disney streaming war has begun. I'll take Disney any day in content. That's easy. $AAPL $DIS https://t.co/jxozQBhvc5,56,274911,216,GerberKawasaki
