,Datetime,Tweet Id,Text,Retweet Count,Followers,Likes,Username
0,2021-03-21 22:35:15+00:00,1373765172075106304,"Leading brands in their industry- 🔦 $GOOG🛌 $ABNB🚲 $PTON☕️ $SBUX🏈 $NKE📱 $AAPL📺 $DIS🎙 $SPOT📦 $AMZN👕 $LULU🔨 $HD🚘 $TSLA🍲 $CMGStrong brands focus on the customer experience above all else= Strong loyalty, increasing margins &amp; pricing power",42,117638,277,BackpackerFI
1,2021-03-21 20:17:34+00:00,1373730526448676868,Options Education 📚The Long Vertical SpreadStocks like $TSLA $AMZN $NVDA $SHOP all have high premiums and can be expensive to trade. Here is a strategy that will lower the cost and also help reduce the impact of theta. Win win! https://t.co/aKovRYcMzi,86,136789,570,ThetaWarrior
2,2021-03-21 12:40:01+00:00,1373615379671617540,Contenders for hardest to disrupt...$SBUX for coffee$GOOG for search$DIS for childhood$AMZN for online retail$TWTR for breaking news$MO for Marlboro$AAPL for phones$PG for Tide laundry detergent$MSFT for its office solutionsWhat else?,41,20780,401,anandchokkavelu
3,2021-03-18 22:21:50+00:00,1372674632327790600,*AMAZON SIGNS 10-YEAR AGREEMENT WITH NFL TO EXCLUSIVELY BROADCAST 15 THURSDAY NIGHT FOOTBALL GAMES &amp; ONE PRE-SEASON GAME PER YEAR ON PRIME VIDEO IN U.S.$AMZN https://t.co/kpy8Y6Tpx6,40,913294,224,Investingcom
4,2021-03-18 21:03:26+00:00,1372654902124580866,"Market is closed, it’s take yo ass to the gym hoursI like some techs to buy and hold $Roku $341 $Spot $271$shop $1,117$Amzn $3,027$Fubo $30We will revisit these in the futureGo workout, all the money in the world doesn’t matter if you aren’t healthy enough to enjoy it https://t.co/ISCqtDnV6E",19,228221,326,CJ_Johnson17th
5,2021-03-18 16:53:03+00:00,1372591893708632065,Just put $10 on $AMZN let that shit ride a week and in set for like 😎,2,39998,141,intellegint
6,2021-03-18 12:40:41+00:00,1372528384656441344,"Oh no, $AMZN entered telehealth, $TDOC is toast.Poor take.Apple/SamsungApple/MicrosoftVisa/MastercardIntel/AMDPepsi/CokeFord/GMWalmart/TargetDunkin/StarbucksJPM/GSRj Reynolds/Philip MorrisBudweiser/MillerUPS/FedExEtc.Competition validates a market.",29,134282,529,cperruna
7,2021-03-18 09:34:21+00:00,1372481491033337856,"Yes, it is ridiculous that the ten year treasury's decline in value (rise in rates) translates into big selling of $MSFT, $AMZN, $AAPL and the like but that's algorithms set to the ten year and nothing else.  Accept it and plan accordingly for 2% ten year...",117,1959756,1294,jimcramer
8,2021-03-17 22:39:16+00:00,1372316635294486528,"If you’re a growth investor, watch this $AMZN",35,172097,253,stocktalkweekly
9,2021-03-17 10:41:59+00:00,1372136123904880640,@SamRo $AMZN 2yr performance after the 60 Minutes piece (% off high) and from the IPO to today.I don't know a ton of people capable of surviving 95% drawdowns. Of those who do the vast (VAST) majority end up riding stocks to $0. https://t.co/MlPg3W3WGJ,16,101922,194,JeffMacke
10,2021-03-17 10:28:10+00:00,1372132647795851272,what they were saying about Amazon in 1999 $AMZN https://t.co/yFn8cG8ONl,5405,60755,18988,SamRo
11,2021-03-17 02:39:02+00:00,1372014583599218688,"$FB, $AMZN, $AAPL, $NFLX, $GOOG have clearly been massive winners since the GFC of 08/9.Who are the next FAANG?  Who wins big tech over the next decade?Tell us 👇. Feel free to explain",48,57418,346,BahamaBen9
12,2021-03-17 00:54:29+00:00,1371988275624349696,How could $AMZN be worth more than Sears ? 😃😂circa 1999 https://t.co/7T40iAeJyi,102,18250,389,Copernicus2013
13,2021-03-17 00:34:27+00:00,1371983231000645636,"""...skeptics say $AMZN would have to sell every book sold in the world today to justify it's stock price.""Bears were harping on the books.They should've focused on the bits.",24,19457,180,KermitCapital
14,2021-03-16 16:50:12+00:00,1371866398964727820,All the mega caps strong today except $TSLA:$AAPL +1.6%$MSFT +1.9%$AMZN +0.6%$GOOG +1.6%$FB +1.8%$TSLA -2.1%Buy the dip.,35,251235,620,garyblack00
15,2021-03-10 22:58:33+00:00,1369784772638179334,"Epic investments involve long rides - the greats try to kick you off.ALL investments hit air pockets. Some ephemeral, some real. Riding to greatness means discerning the difference.Wisdom in those moments requires *knowing* what you own.Ex: $AMZN https://t.co/8g8cmFt0wZ",61,32597,296,compound248
16,2021-03-09 01:28:29+00:00,1369097726865080324,Cathie Wood &amp; Ark Invest's trade activity from today 3/8Bought: Draftkings $DKNG Sea Limited $SE $ROKU $KSPILI $JD $SEER $SDGR $RPTX $CDXS $BFLY $ACCD $FATE $BLI $BEAM $NIU $KTOS $ESLT $AONE $SKLZSold: $FB $TSM $GOOGL $REGN $RHHBY $ICE $PYPL $DE $CAT $AMZN $NFLX $BIDU $API https://t.co/Om7OPB3Jxw,43,89857,260,ArkkDaily
17,2021-03-09 00:08:27+00:00,1369077586136031234,We Take your licks. One of my favorite things abt trading is the ability to ALWAYS get betterAlot of noise recently. If they aren’t paying yo mf bills they don’t get a space in your head. Be good.$TSLA $QQQ $SPY $AMZNAll been getting hit. But we have been prepared for this https://t.co/TZhVg8TNyB,3,235067,252,Hugh_Henne
18,2021-03-07 04:24:03+00:00,1368417133965705224,"You remember when $AMZN fluctuated from $900s to $500s? If you fast forward many years and look back today, it just seems like a tiny blip in the charts. This is how long term $TSLA investors will feel 5+ years from now. Stay long and strong! 💪 https://t.co/A6PPGxYyJR",59,63131,513,Teslaconomics
19,2021-03-06 15:07:02+00:00,1368216558514958344,$PLTR teams up with $AMZN AWSLong $PLTR,79,134282,651,cperruna
20,2021-03-05 23:40:34+00:00,1367983406571794437,Cathie Wood &amp; Ark Invest's trade activity from today 3/5$DKNG $Z $TSLA $ROKU $PLTR $SPCE $TTD $NVDA $PYPL $AAPL $AMZN $WKHS $SPOT $TCEHY $NTDOY $TDOC $GOOGL $FB https://t.co/BxtGQg9gZy,51,89857,319,ArkkDaily
21,2021-03-05 20:05:22+00:00,1367929248145543168,Fully Invested Portfolio (Allocation size) :1. $TDOC 2. $SE 3. $PINS 4. $SKLZ 5. $ROKU 6. $NET 7. $PTON 8. $HAACW 9. $DDOG 10. $CRWD 11. $SRAC 12. $ABNB 13. $AMZN 14. $GDRX 15. $AAPL 16. $TWLO 17. $NSH 18. $SFTW 19. $U 20. $NTNX ....and some more.Planning to ride this for now.,34,25288,491,Soumyazen
22,2021-03-05 01:51:29+00:00,1367653963848421378,% moves from 52-week closing highs:$FB -15.2%$AMZN -15.7%$AAPL -16.1%$NFLX -12.8%$NVDA -19.3%$TSLA -29.6%$WMT -16.5%$TGT -14.7%$COST -18.6%$ADBE -17.7%$CRM -27.0%$SHOP -22.0%$PYPL -21.6%$ZM -39.6%$LULU -28.4%$HD -14.0%$LOW -14.2%,116,80332,581,conorsen
23,2021-03-04 23:48:08+00:00,1367622920688848900,Cathie Wood &amp; Ark Invest's trade activity from today 3/4$SHOP $FB $GOOGL $SQ $TDOC $U $Z $ZM $ROKU $PYPL $TSM $ICE $TCEHY $NTDOY $WKHS $AMZN $AAPL $OPEN $NFLX https://t.co/T0htzmPhpy,83,89857,612,ArkkDaily
24,2021-03-04 14:48:27+00:00,1367487106386427913,Dave Portnoy's $BUZZ ETF is now live. Top holdings:1. $TWTR2. $DKNG3. $F4. $FB5. $AMZN6. $AAPL7. $AMD8. $AAL9. $NFLX10. $TSLA,49,293971,362,MarketRebels
25,2021-03-04 00:38:00+00:00,1367273084093358082,"In 1997, the bear case against $AMZN was strongIn 2004, the bear case against $NFLX was strongIn 2010, the bear case against $TSLA was strongIf you want to own the next big winner, you have to be willing to buy and hold in the face of huge uncertainty",267,405603,1981,BrianFeroldi
26,2021-03-04 00:33:02+00:00,1367271835574947840,"My positions going into tomorrow:6,000 $TSLA averaged at $6611,000 $AAPL averaged at $125300 $AMZN averaged at $3,128500 $ZM averaged at $360500 $FB at $255500 $BYND at $13950 $BKNG at $2,284200 $NFLX at $526It was like black Friday shopping today. https://t.co/RALOjQ8E89",11,68072,316,squawksquare
27,2021-03-03 22:15:53+00:00,1367237319665717248,From 52wk H-6% $GOOGL-8% $MSFT-12% $HD $NFLX $SE-15% $AMZN-16% $AAPL $FB-17% $NVDA $SQ $WMT-18% $PYPL $QCOM-19% $AMD $SHOP-20% $TWLO-24% $ROKU $DOCU-27% $OPEN-28% $TSLA-29% $TTD-34% $TDOC-37% $PTON-42% $ZM-48% $PLTR-49% $SPCE-50% $FSLY-56% $NNOX-62% $BIGC,94,12628,455,PeterTrader99
28,2021-03-03 22:04:23+00:00,1367234425763721219,$FUBO hearing Amazon $AMZN partnership or Apple $AAPL after DraftKings deal this morning.,38,72464,301,TheLioncom
29,2021-03-03 18:20:34+00:00,1367178099960537091,Dafuq is going on with $COST $WMT $TGT and $AMZN? Can you even call yourself an American consumer if you don’t buy from these daily?,11,308521,225,RampCapitalLLC
30,2021-03-03 17:19:00+00:00,1367162604548853762,The John W. Rich ETFLong:Wendy's $WENCracker Barrel $CBRLWingstop $WINGBJ's Restaurants $BJRIDenny's $DENNRCI Hospitality $RCIDestination XL $DXLGCoca-Cola $KOAnheuser Busch $BUDAOL $AOLYahoo $YHOOShort:Berkshire Hathaway $BRK.AAmazon $AMZNNetflix $NFLX,29,190353,452,Cokedupoptions
31,2021-03-02 21:13:03+00:00,1366859119446081543,"More ugly action in Big Tech + Tesla, but a lot of green elsewhere for the most part.$AAPL $MSFT $AMZN $TSLA https://t.co/AvTnkkmarH",54,51413,263,JesseCohenInv
32,2021-03-01 14:55:45+00:00,1366401781689950208,Could Amazon be the deal $AITX just landed ??? Some hinting towards this $AMZN 🚀💰,38,153445,369,incarceratedbob
33,2021-02-28 02:21:53+00:00,1365849673253203969,$LINK at $27 is like $AMZN at $27 ... except a million times more impactful on the entire world.,30,16816,308,rBryer23
34,2021-02-26 14:58:01+00:00,1365315188342345729,"If you are reading this, you are early to #Bitcoin. How do I know? Imagine thinking you were late to $AMZN in 2010. It was trading at $133. Yes, you missed $10 a decade before, but it will go on to hit $3500 for a 26x gain. Don't fixate on the past, focus on the future potential. https://t.co/96ASdGyuF7",673,706666,4194,cameron
35,2021-02-26 03:11:08+00:00,1365137293087043588,"$AMZNThere is time to fix it, but this consolidation doesn't seem to be resolving in the direction we had all hoped. https://t.co/s6j7VaEC1i",26,93417,241,the_chart_life
36,2021-02-26 02:03:41+00:00,1365120319975956480,$ARKK $ARKG updateI think @CathieDWood  is blowing up her fundSold her most stable cos$AMZN 25%$AAPL 18%$CRM 100% ($100M)$RGN 6%$NVS$TSM 33%Added on her biggest overvalued$TSLA down to 6% of port. from 9% despite buying Adding $TDOC $SQ $BEAM $TWTR https://t.co/an4SYLliSc,62,23569,404,TheMarketDog
37,2021-02-26 00:20:30+00:00,1365094354113630210,Wow @CathieDWood and team were BUSY todayBig Buys today$BIDU $149.1M$TDOC $128.3M$SQ $22.9M$PYPL $22.0M$TSLA $16.4M$SHOP $9.7M$SPOT $9.3M$OPEN $8.8M$SKLZ  $5.7MBig Sold Positions$ROKU $91M$BABA $90.6M$PINS $70.1M$SE $41.2M$AMZN $29.8M$CRM $23.3M$AAPL $5.7M,51,81638,375,Dividend_Dollar
38,2021-02-25 15:55:29+00:00,1364967260738236423,"Many of the people saying stocks are overvalued are the same people that never bought $AMZN $NVDA or $NFLX because they were always ""overvalued"".It's amazing how many investors spout off about stocks and valuations yet have horrible track records. Stop listening to clowns.",83,556562,1002,JonahLupton
39,2021-02-25 00:40:00+00:00,1364736870895276032,"I'm BULLISH on all these sectors, but which one are you MOST bullish on next 12mo?📦 E-Com$AMZN$BABA$SHOP$ETSY💳 FinTech$PYPL$SQ$V🤖 Cyber$CRWD$OKTA$ZS⚡️ EVs$TSLA$NIO$CCIV🎮 Gaming$SKLZ$SE🏡 Real Estate$RDFN$Z$OPEN💊 Healthcare$TDOC$TMDX$DMTK",95,81638,509,Dividend_Dollar
40,2021-02-24 17:25:24+00:00,1364627501146927107,It’s amazing how dead $amzn stock has been.  Institutions already own it in this range.  Retail thinks it’s to cost intensive to buy.  Jeff and MacKenzie are net sellers.  Boy did they drop the ball with no stock split post earnings.,26,186008,429,RedDogT3
41,2021-02-24 09:48:45+00:00,1364512583231897605,"$TSLA and other secular growers should continue their rebound today as the reflation trade eases. With everyone now on the same page, the sharp rise in int rates may pause here, and traders should return to beaten up growth names like $TSLA $AMZN $FB $GOOGL $MSFT $HD $PYPL etc.",45,251235,709,garyblack00
42,2021-02-24 00:52:11+00:00,1364377548050882562,Cathie Wood &amp; @ARKInvest trade activity from todayBought: Twitter $TWTR Tesla $TSLA Spotify $SPOT Facebook $FB $DISCA $OPEN $MASS $SGFY $BFLY $ACCD $RPTX $U $TXG $BEAM $FATE $VUZI $EXPC $RAVNSold: Amazon $AMZN Apple $AAPL $SPLK $TMO $HIMS $GOOGL $Z $TCEHY $ROKU $SE $TSM $CRM https://t.co/7H1w2nwK2g,69,89857,404,ArkkDaily
43,2021-02-24 00:15:25+00:00,1364368297681178627,"If your behavior is wrong, great stocks won't save youYou could buy the next $AMZN and still lose money",22,405603,202,BrianFeroldi
44,2021-02-23 14:04:48+00:00,1364214629174571013,"#Bitcoin is the dominant digital monetary network.  It reached a $1 trillion market cap faster than $AAPL, $AMZN, $GOOG, or $MSFT, and it is inevitable that billions of people will rely on it to store &amp; channel their monetary energy.",1005,2781142,5444,saylor
